<!ELEMENT reviews (review+)>

<!ELEMENT review (userId, productId, rating, comment, date?)>
<!ATTLIST review
    id ID #REQUIRED>

<!ELEMENT userId (#PCDATA)>
<!ELEMENT productId (#PCDATA)>
<!ELEMENT rating (#PCDATA)>
<!ELEMENT comment (#PCDATA)>
<!ELEMENT date (#PCDATA)>
